### ISSUE TITLE
3proxy перестал работать на CentOS 9 Stream

### ISSUE THREAD

**Issue by dv-falc** [3proxy/3proxy#1146]
Добрый день.
CentOS 9 Stream
3 proxy был скомпилирован и работал с 2022. Версия  0.9.3
Недавно обновился через репозиторий до 0.9.5. Запускается но не работает. 
Скачал исходники скомпилировал - не работает.
версия 0.9.3 тоже перестала работать.
Сделал update CentOS - не работает
запустил с простейшей конфигурацией  
log
auth none
allow *
proxy 
Не работает

запустил 
proxy -l 
на консоли единственная строка 
250621060142.765 3128 00000 - 0.0.0.0:0 0.0.0.0:0 0 0 0 Accepting connections [1383286/2552997696] 

netstat -nlp
tcp        0      0 0.0.0.0:3128            0.0.0.0:*               LISTEN      1383286/proxy

tcpdump -n port 3128  показывает что запросы приходят. Ну порт естественно открыт в firewall

Клиенты Proxifier (windows и MAC) и firefox

Проверка происходит на www.google.com:80
 tcpdump -n port 80 не показывает ни одного исходящего пакета

Запустил  socks -l -p3128
здесь ситуация несколько иная 

tcpdump -n port 80 

09:26:54.253272 IP X.X.X.X.60085 > 216.58.210.164.http: Flags [S], seq 2733026690, win 32120, options [mss 1460,sackOK,TS val 2093146917 ecr 0,nop,wscale 7], length 0
09:26:54.254444 IP 216.58.210.164.http > X.X.X.X.60085: Flags [S.], seq 2608648075, ack 2733026691, win 65535, options [mss 1412,sackOK,TS val 2037046672 ecr 2093146917,nop,wscale 8], length 0
09:26:54.254515 IP X.X.X.X.60085 > 216.58.210.164.http: Flags [.], ack 1, win 251, options [nop,nop,TS val 2093146918 ecr 2037046672], length 0
и всё . больше пакетов нет

proxifier:
Proxy Server
	Address:	X.X.X.X:3128
	Protocol:	SOCKS 5
	Authentication: NO

[27:02] Starting: Test 1: Connection to the Proxy Server
[27:02] IP Address: X.X.X.X
[27:02] Connection established
[27:02] Test passed.
[27:02] Starting: Test 2: Connection through the Proxy Server
[27:02] Authentication was successful.
[27:21] Error : connection to the proxy server was closed unexpectedly.
[27:21] Test failed.
[27:21] Testing Finished.

Прошу помощи

**Comment by dv-falc** [comment]
Добрый день. Не один из этих вариантов не проходит. 
1. tcpdump показывает что запросы приходят.
2. Ну прокси указан в клиенте, так как запросы приходят
3. Порт открыт в firewall
4. netstat после остановки сервиса 3proxy не показывает чтобы кто то что то слушал на порту. Да и обычно exception возникает если пытаться слушать порт, который уже захвачен. 
5.  Изначально не указал что сервер за границей. Поднял 3proxy на сервере в России  на той же centos 9 stream. Все работает прекрасно.  Думаю  в сторону РКН 
6.  Да и замечание logformat "L....." Время на компьютере MSK. в логе время GMT
