### ISSUE TITLE
syn dropped course of local port reuse

### ISSUE THREAD

**Issue by hunterhe23** [3proxy/3proxy#715]
client->3proxy->fillwall->webserver.
when the request volume is big, few 3proxy tcp-syn to webserver may be dropped by firewall.
tcpdump shows that 3proxy uses random local port to syn. when reused same local port in a short time, and firewall haven't release last session with same port, it will drop the new one.
other proxy, like nginx or haproxy use ordinal local port to aviod this problem.
does 3proxy support ordinal local port?
thankyou.

**Comment by z3APA3A** [comment]
3proxy doesn't set SO_REUSEADDR/SO_REUSEPORT for outgoing connection unless explicitly configured. Check you have sufficient number of ephemeral ports and /proc/sys/net/ipv4/tcp_tw_recycle /proc/sys/net/ipv4/tcp_tw_reuse disabled.

**Comment by hunterhe23** [comment]
yes i have sufficient number of ephemeral ports.
sysctl.conf:
/proc/sys/net/ipv4/tcp_tw_recycle=0
/proc/sys/net/ipv4/tcp_tw_reuse=0
/proc/sys/net/ipv4/ip_local_port_range=1024 65535

when webserver close the connection on his own initiative, 3proxy recycle a connection and local port soon without transforming into timewait.
so it may use that local port again soon course of random local port.
that maybe a problem, becourse firewall will hold the closed connection for several seconds for security, and it will drop syn with same ip and port.
if ordinal local port, it will take a period of time to reuse same port, that will avoid syn dropping by firewall.
hardware loadbanlancer like F5 also run with ordinal local port, besides nginx/haproxy.
maybe they encounter same problem as a high concurrency system.

**Comment by z3APA3A** [comment]
![изображение](https://user-images.githubusercontent.com/7222768/143891865-7e581568-d632-4046-b1f6-68938c704934.png)
TIME_WAIT is only possible if termination is initiated by client (3proxy)

**Comment by hunterhe23** [comment]
agree.
i mean when server(webserver) closed the connection, client(3proxy) don't need to transform into time_wait, so it can be reuse soon.
if client(3proxy) close the connection, these is not problem, course it will take 2MSL to recycle, and firewall have released the session.

**Comment by z3APA3A** [comment]
I mean if connection is closed by remote side, local port is immediately closed after receiving the final ACK. No information on this port is left in the system, and it can be reused almost immediately depending on system approach to ephemeral port selection. It's expected behavior and there is little 3proxy can do about it. What is unexpected is your firewall's behavior. The only possible solution is to implement client port selection on 3proxy side and make this selection non-random, and it sounds weird.

**Comment by hunterhe23** [comment]
yes you are right, system local port selection is random, non-random selection can only be implemented on application, like nginx.
firewall is usual in network and other users may encounter the same problem.
so i think it is very useful.
or another solution, could 3proxy support tcp keepalive for a few seconds?

**Comment by hunterhe23** [comment]
keepalive may have no use to this.
it seems that only non-random local port will work.

**Comment by z3APA3A** [comment]
In the case you perform NAT, you can try to add pool of (external) IPs to 3proxy and make random selection of external IP, e.g.
parent 200 extip 1.1.1.1 0
parent 200 extip 1.1.1.2 0
parent 200 extip 1.1.1.3 0
parent 200 extip 1.1.1.4 0
parent 200 extip 1.1.1.5 0
it will make selection of the same port in the short time less probable + you can increase number of attempts with `parentretries`. 

Actually, you can try this trick with single IP address without NAT either.

**Comment by hunterhe23** [comment]
i configure 5 extip (same net with eth0 ip), but it doesn't work.
access_log shows that 3proxy does not use extip pool to connect.it still use eth0 ip only.
is there any other config to make extip effect?

**Comment by hunterhe23** [comment]
i configure 5 extip (same net with eth0 ip), but it doesn't work.
access_log shows that 3proxy does not use extip pool to connect.it still use eth0 ip only.
is there any other config to make extip effect?

**Comment by z3APA3A** [comment]
Show full config, may be you use auth none or start proxy prior to ACL configuration.

**Comment by hunterhe23** [comment]
nserver 10.2.10.66
ncache 65535
config /conf/3proxy.cfg
allow * 10.2.20.100
parent 200 extip 10.2.30.11 0
parent 200 extip 10.2.30.12 0
parent 200 extip 10.2.30.13 0
parent 200 extip 10.2.30.14 0
parent 200 extip 10.2.30.15 0
log /logs/3proxy.log D
rotate 30
maxconn 100000
proxy -u
socks -u

**Comment by hunterhe23** [comment]
new update:
for given destination ip and port, linux kernel choose source port sequentially, every time +2.
see kenel function inet_hash_connect, inet_sk_port_offset, inet_sk_bound_l3mdev.
i made a test, confirming that nginx/curl/wget/ftp/sftp/rsync all follow this feature.
does 3proxy make it's own random source port function instead of kernel and why?

**Comment by z3APA3A** [comment]
https://github.com/3proxy/3proxy/blob/master/src/common.c#L445

**Comment by z3APA3A** [comment]
which 3proxy version are you using?

**Comment by hunterhe23** [comment]
latest 0.9.4, but REALEASE shows 0.9.3.

**Comment by hunterhe23** [comment]
latest 0.9.4, but REALEASE shows 0.9.3.

**Comment by hunterhe23** [comment]
what does this mean?
*SAPORT(&param->sinsl) = 0;
	if(so._bind(param->remsock, (struct sockaddr*)&param->sinsl, SASIZE(&param->sinsl))==-1) {
		return 12;

what's the function of variable sincl, sincr, sinsl, sinsr?

**Comment by z3APA3A** [comment]
sinsl is sockaddr structure for local end of proxy to server connection.
It sets local port for remote connection to 0, 0 port means system to choose the port for binding.

**Comment by z3APA3A** [comment]
If you use large number of connections, make sure you _do_ set SO_REUSEADDR for proxy-to-server socket, see https://3proxy.ru/highload.asp and https://stackoverflow.com/questions/14388706/how-do-so-reuseaddr-and-so-reuseport-differ

**Comment by z3APA3A** [comment]
You can also try to increase BYTE_SHORT timeout, 3proxy uses this timeout to set socket linger
https://github.com/3proxy/3proxy/blob/f53b0eb985a019071229c39668eb44ba022f7edc/src/common.c#L404
it's the time socket (and port) is still reserved after closing. By default it's 1 second.

**Comment by hunterhe23** [comment]
there is just one connection at same time.
the cause is random source port usage.

increasing BYTE_SHORT to 60s or setting SO_REUSEADDR or SO_KEEPALIVE for proxy-to-server socket, does not work neigher. 
the connection still terminates quickly , no linger.

if 0 port means system to choose the port, why it is not sequential +2, but random?

**Comment by z3APA3A** [comment]
You may check this code:
https://github.com/torvalds/linux/blob/2585cf9dfaaddf00b069673f27bb3f8530e2039c/net/ipv4/inet_connection_sock.c#L204
it looks like you have to set SO_REUSEADDR for non-random port selection. Use -osSO_REUSEADDR.

**Comment by z3APA3A** [comment]
Actually, it seems at least in current version port is always randomised via prandom_u32(). You can check the logic for kernel version you use.

**Comment by hunterhe23** [comment]
i have set -osSO_REUSEADDR,but it does not work.
I test from same linux(kenel: 3.10.0-1160.el7.x86_64), and tcpdump.
3proxy(10.2.3.4) access 14.215.62.24 port 80 (random source port):
16:26:42.459644 IP 10.2.3.4.6767 > 14.215.62.24.80: Flags [S], seq 3440815218,
16:26:42.476059 IP 10.2.3.4.5134 > 14.215.62.24.80: Flags [S], seq 2539994248,
16:26:42.494677 IP 10.2.3.4.29668 > 14.215.62.24.80: Flags [S], seq 2355622962,
16:26:42.513846 IP 10.2.3.4.7811 > 14.215.62.24.80: Flags [S], seq 4055327616,
16:26:42.633344 IP 10.2.3.4.9643 > 14.215.62.24.80: Flags [S], seq 3809045499,
16:26:42.858404 IP 10.2.3.4.31595 > 14.215.62.24.80: Flags [S], seq 2541473874,
16:26:42.879004 IP 10.2.3.4.27211 > 14.215.62.24.80: Flags [S], seq 1826147594,
16:26:42.897568 IP 10.2.3.4.4268 > 14.215.62.24.80: Flags [S], seq 779675902,
16:26:42.916849 IP 10.2.3.4.29513 > 14.215.62.24.80: Flags [S], seq 713520910,
16:26:42.935116 IP 10.2.3.4.28156 > 14.215.62.24.80: Flags [S], seq 946150153,

nginx(or curl/wget) access 14.215.62.24 port 80 (sequential source port, each+2):
16:23:14.867135 IP 10.2.3.4.53192 > 14.215.62.24.80: Flags [S], seq 1311356928,
16:23:14.888238 IP 10.2.3.4.53194 > 14.215.62.24.80: Flags [S], seq 4091491043,
16:23:14.908822 IP 10.2.3.4.53196 > 14.215.62.24.80: Flags [S], seq 1695835245,
16:23:14.932649 IP 10.2.3.4.53198 > 14.215.62.24.80: Flags [S], seq 3464493188,
16:23:14.953425 IP 10.2.3.4.53200 > 14.215.62.24.80: Flags [S], seq 1838473223,
16:23:14.974861 IP 10.2.3.4.53202 > 14.215.62.24.80: Flags [S], seq 2089645558,
16:23:14.995916 IP 10.2.3.4.53204 > 14.215.62.24.80: Flags [S], seq 3782263144,
16:23:15.016263 IP 10.2.3.4.53206 > 14.215.62.24.80: Flags [S], seq 3750556624,
16:23:15.038978 IP 10.2.3.4.53208 > 14.215.62.24.80: Flags [S], seq 4134987442,
16:23:15.061681 IP 10.2.3.4.53210 > 14.215.62.24.80: Flags [S], seq 1661264704,

it seems only 3proxy do not follow the kernel feature.

**Comment by hunterhe23** [comment]
excuse me, can it be fixed?

**Comment by z3APA3A** [comment]
There is nothing to fix on 3proxy side. Check the port selection for your kernel version. Current kernel versions always perform random port selection. Older version may have different logic.
